date,client,tweet,preemptive_framing,diversion,trial_ballooon,deflection,salient_exemplar
2010-10-01 11:59:59,Twitter Web Client,Read Ivanka's blog about last night's Apprentice on Entertainment Weekly ...http://bit.ly/bMNF72,0,0,0,0,0
2010-10-06 09:40:23,Twitter Web Client,"I'm honored to be presented the award of Doctor of Business Administration Honoris Causa from Robert Gordon University in Aberdeen, Scotland",0,0,0,0,0
2010-10-07 10:11:11,Twitter Web Client,Don't forget to tune in tonight for another exciting episode of The Apprentice--10 p.m. on NBC.,0,0,0,0,0
2010-10-07 10:22:41,Twitter Web Client,Scotland is beautiful and Trump Internatonal Golf Links-Scotland is progressing beautifully as well. http://bit.ly/bUWWNb,0,0,0,0,0
2010-10-14 10:00:16,Twitter Web Client,"Be sure to watch The Apprentice tonight, 10 p.m. on NBC--it's an episode you won't forget!",0,0,0,0,0
2010-10-14 13:48:29,Twitter Web Client,"An HR solutions company polled 01,000 employed adults to find out who would make ideal bosses... http://bit.ly/9uP9vj",0,0,0,0,0
2010-10-21 12:38:25,Twitter Web Client,Don't forget to tune in tonight to see another unpredictable and exciting episode of The Apprentice-- 10 pm on NBC,0,0,0,0,0
2010-10-27 09:14:12,Twitter Web Client,"Be prepared for a sensational episode of The Apprentice tomorrow night, 10 pm on NBC.",0,0,0,0,0
2010-10-28 14:53:40,Twitter Web Client,"I was on The View this morning. We talked about The Apprentice. Tonight's episode is a great one--tough, exciting and surprising. 10 pm/NBC",0,0,0,0,0
