date,client,tweet,preemptive_framing,diversion,trial_ballooon,deflection,salient_exemplar
2009-07-04 19:19:56,Twitter Web Client,Here's to a safe and happy Independence Day for one and all - Enjoy it! --Donald J. Trump,0,0,0,0,0
2009-07-13 10:03:38,Twitter Web Client,"""Be aware of things that seem inexplicable because they can be a big step towards innovation."" --Donald J. Trump http://tinyurl.com/pqpfvm",0,0,0,0,0
2009-07-15 09:40:35,Twitter Web Client,Donald Trump backs 'Apprentice' Randal Pinkett for N.J. Lieutenant Governor: http://tinyurl.com/mvovzb,0,0,0,0,0
2009-07-22 11:32:52,Twitter Web Client,"Congrats to winners from around the world who entered the ""Think Like A Champion"" signed book/keychain contest! http://tinyurl.com/pqpfvm",0,0,0,0,0
2009-07-28 11:50:31,Twitter Web Client,Check out a list of Donald Trump's books for summer reading at the Trump University Blog: http://tinyurl.com/knyswt,0,0,0,0,0
